{
  "round_id": "run-6",
  "model_account": "chatgpt",
  "seat_id": "chatgpt",
  "run_marker": "AI_JUDGE_RUN_MARKER:WORLD_CUP_RUN6_20260603",
  "raw_text": "{\"model_account\":\"chatgpt\",\"round_id\":\"run-6\",\"loan_decision\":{\"amount\":0,\"reason\":\"\"},\"bet_ledger\":[{\"match_id\":\"WARM-002\",\"market\":\"moneyline\",\"selection\":\"Brazil\",\"stake\":200,\"odds\":1.85,\"confidence\":0.68,\"reason\":\"Strong home record\",\"cancel_if\":\"\"}],\"risk_rules\":{\"max_loss\":500,\"stop_after_losses\":2},\"source_cards\":[],\"betting_thought\":\"Brazil strong favorite at home.\"}",
  "parsed_json": null,
  "schema_valid": true,
  "parse_errors": [],
  "pollution_signals": [],
  "created_at": "2026-06-03T12:05:00Z"
}
